
DATA FILE: E:/Program Files/PBTools1.2.1/Projects/Demo/Data/Lecture/augrcbex.csv

SINGLE-ENVIRONMENT ANALYSIS

DESIGN: Augmented RCB

==============================
GENOTYPE AS: Fixed
==============================

------------------------------
RESPONSE VARIABLE: YIELD
------------------------------

Data Summary:

Number of observations read:  84 
Number of observations used:  84 

 Factors   Number of Levels   Levels         
 ENTRY     66                 1  10  11 ... 9
 BLOCK     4                  1  2  3  4     

Testing for the Significance of Genotypic Effect:

Models:
model2: YIELD ~ 1 + (1|BLOCK)
model1: YIELD ~ 1 + ENTRY + (1|BLOCK)

       Df    AIC    BIC   logLik  Chisq Chi Df Pr(>Chisq)
model2  3 296.39 303.69 -145.198                         
model1 68 233.75 399.05  -48.877 192.64     65  1.441e-14

      Df   Sum Sq  Mean Sq  F value p-value
ENTRY 65 141.5008 2.176935 2.483491  0.0000

Genotype LSMeans and Standard Errors:

   ENTRY LSMean StdErrMean
1      1 6.3500  0.9362491
2     10 1.0500  0.9362491
3     11 3.7500  0.9362491
4     12 3.8000  0.9362491
5     13 4.4000  0.9362491
6     14 2.6000  0.9362491
7     15 3.4000  0.9362491
8     16 8.2500  0.9362491
9     17 4.2500  0.9362491
10    18 4.3500  0.9362491
11    19 5.9000  0.9362491
12     2 6.5000  0.9362491
13    20 4.4000  0.9362491
14    21 1.8000  0.9362491
15    22 3.4500  0.9362491
16    23 5.5000  0.9362491
17    24 5.4000  0.9362491
18    25 4.8000  0.9362491
19    26 4.7000  0.9362491
20    27 4.9000  0.9362491
21    28 3.7500  0.9362491
22    29 6.2000  0.9362491
23     3 3.9500  0.9362491
24    30 4.5000  0.9362491
25    31 2.4000  0.9362491
26    32 4.0000  0.9362491
27    33 3.9000  0.9362491
28    34 6.6000  0.9362491
29    35 5.3000  0.9362491
30    36 3.9000  0.9362491
31    37 5.1500  0.9362491
32    38 3.7000  0.9362491
33    39 5.3000  0.9362491
34     4 5.6000  0.9362491
35    40 7.0000  0.9362491
36    41 4.7000  0.9362491
37    42 3.4000  0.9362491
38    43 1.5000  0.9362491
39    44 4.0500  0.9362491
40    45 5.5500  0.9362491
41    46 5.6000  0.9362491
42    47 3.8500  0.9362491
43    48 3.4000  0.9362491
44    49 3.4000  0.9362491
45     5 2.0000  0.9362491
46    50 4.9000  0.9362491
47    51 3.2000  0.9362491
48    52 2.0000  0.9362491
49    53 3.0000  0.9362491
50    54 4.0500  0.9362491
51    55 2.2000  0.9362491
52    56 3.0500  0.9362491
53    57 6.5000  0.9362491
54    58 7.0000  0.9362491
55    59 4.4000  0.9362491
56     6 3.5000  0.9362491
57    60 7.5000  0.9362491
58    61 3.7375  0.4681246
59    62 4.3375  0.4681246
60    63 3.5125  0.4681246
61    64 4.5500  0.4681246
62    65 5.1000  0.4681246
63    66 4.1750  0.4681246
64     7 4.5500  0.9362491
65     8 3.9000  0.9362491
66     9 4.2000  0.9362491


Significant Pairwise Comparisons (if any): 
Compared with control(s)

   Trmt[i] Trmt[j] Estimate          lwr         upr
1       16      61   4.5125  1.028367045  7.99663305
2       60      61   3.7625  0.278367045  7.24663305
3       16      62   3.9125  0.428440838  7.39655921
4       16      63   4.7375  1.252336161  8.22266398
5       40      63   3.4875  0.002336161  6.97266398
6       58      63   3.4875  0.002336161  6.97266398
7       60      63   3.9875  0.502336161  7.47266398
8       10      65  -4.0500 -7.534861112 -0.56513903
9       43      65  -3.6000 -7.084861064 -0.11513898
10      10      64  -3.5000 -6.984711428 -0.01528857
11      16      64   3.7000  0.215288619  7.18471148
12      16      66   4.0750  0.591288918  7.55871118


==============================
GENOTYPE AS: Random
==============================

------------------------------
RESPONSE VARIABLE: YIELD
------------------------------

Data Summary:

Number of observations read:  84 
Number of observations used:  84 

 Factors   Number of Levels   Levels         
 ENTRY     66                 1  10  11 ... 9
 BLOCK     4                  1  2  3  4     

Predicted means:

   ENTRY    Means
1      1 5.288790
2     10 2.957300
3     11 3.960251
4     12 4.194062
5     13 4.411814
6     14 3.602297
7     15 3.802845
8     16 6.094043
9     17 4.344354
10    18 4.340091
11    19 4.927173
12     2 5.197012
13    20 4.411814
14    21 3.294599
15    22 3.984569
16    23 4.958605
17    24 4.812309
18    25 4.432469
19    26 4.546733
20    27 4.688766
21    28 4.119488
22    29 5.062093
23     3 4.209434
24    30 4.407550
25    31 3.564438
26    32 4.182685
27    33 4.239035
28    34 5.401223
29    35 4.657335
30    36 4.137712
31    37 4.589875
32    38 4.047765
33    39 4.657335
34     4 4.902255
35    40 5.531879
36    41 4.546733
37    42 3.802845
38    43 3.058356
39    44 4.306495
40    45 4.769767
41    46 4.951491
42    47 4.005224
43    48 3.912846
44    49 3.962082
45     5 3.384545
46    50 4.688766
47    51 3.924223
48    52 3.283222
49    53 3.732953
50    54 4.306495
51    55 3.373168
52    56 3.856763
53    57 5.197012
54    58 5.421878
55    59 4.411814
56     6 4.059142
57    60 5.858068
58    61 3.881068
59    62 4.340526
60    63 3.708772
61    64 4.503251
62    65 4.924420
63    66 4.216089
64     7 4.430037
65     8 4.186948
66     9 4.162630

Heritability:
     
0.47 

Testing for the Significance of Genotypic Variance:
Models:
model2: YIELD ~ 1 + (1|BLOCK)
model1: YIELD ~ 1 + (1|BLOCK) + (1|ENTRY)

       Df    AIC    BIC  logLik  Chisq Chi Df Pr(>Chisq)
model2  3 296.39 303.69 -145.20                         
model1  4 297.58 307.30 -144.79 0.8155      1     0.3665


==============================
